{"digest":"sha256:d70c409989907fb9194417d737ec25d8dd56e7ab36911dbf5b43db5d620b3594","entries":[{"digest":"sha256:b6a98d9ce9a2d9149288fa3df42d377c3e42737afdcdaf714e33c0a100b51060","executable":false,"kind":"regular","path":"a.txt","size":6,"target":null},{"digest":"sha256:f2c82decdd7181cf98945929a62598db7e6b477e11f6e0eb0ae97020eff151ad","executable":false,"kind":"regular","path":"nested/b.txt","size":5,"target":null}],"exclusion_policy_digest":"sha256:f1094a986da18b3b683c3ba12784311673ab006f9a14877d3b2acc5d61408299","exclusions":[],"limits":{"max_entries":100000,"max_file_bytes":16777216,"max_snapshot_bytes":4294967296},"schema":"source-manifest-v2","total_size":11}
